{
    "manifestID": "MANI123456",
    "dispatchDate": "2025-09-02",
    "dateScheduledForPickup": "2025-09-02",
    "temperatureAtPickup": 4.2,
    "sendingFacilityID": "FACILITY001",
    "sendingFacilityName": "General Hospital Maitama",
    "receivingPCRLabID": "LIMS150002",
    "receivingPCRLabName": "National Reference Lab Abuja",
    "receivingLabID": "LIMS150002",
    "receivingLabName": "National Reference Lab Abuja",
    "samplePackagedBy": "Nurse ADAMU",
    "courierRiderName": "Rider MUSA",
    "courierContact": "08031234567",
    "testType": 1,
    "courier": {
      "name": "NG Courier Ltd",
      "contactNumber": "08030000000"
    },
    "specimenList": [
      {
        "sampleID": "SMP0000001",
        "patientIDs": [
          { "idNumber": "HOSP0001234", "idTypeCode": "HOSPITALNO" },
          { "idNumber": "REC00056789", "idTypeCode": "RECENCY" }
        ],
        "firstName": "AMINU",
        "surName": "BELLO",
        "sex": "M",
        "age": 34,
        "dateOfBirth": "1991-03-12",
        "sampleType": "PLASMA",
        "indicationVLTest": "Routine monitoring",
        "artCommencementDate": "2021-02-15",
        "drugRegimen": "TDF/3TC/DTG",
        "sampleOrderedBy": "Dr. KOLA",
        "sampleOrderDate": "2025-09-01",
        "sampleCollectedBy": "Nurse LADI",
        "sampleCollectionDate": "2025-09-01",
        "sampleCollectionTime": "2025-09-01T08:25:00Z",
        "dateSampleSent": "2025-09-02",
        "priority": 2,
        "packagingCondition": 2,
        "sampleIntegrity": 1,
        "clinicalNotes": "No symptoms reported."
      },
      {
        "sampleID": "SMP0000002",
        "patientIDs": [
          { "idNumber": "HOSP0002234", "idTypeCode": "HOSPITALNO" }
        ],
        "firstName": "ZAINAB",
        "surName": "USMAN",
        "sex": "F",
        "pregnantBreastFeedingStatus": "Pregnant",
        "age": 28,
        "dateOfBirth": "1997-05-20",
        "sampleType": "WHOLE_BLOOD",
        "indicationVLTest": "Pregnancy monitoring",
        "artCommencementDate": "2023-10-01",
        "drugRegimen": "ABC/3TC/DTG",
        "sampleOrderedBy": "Dr. OKON",
        "sampleOrderDate": "2025-09-01",
        "sampleCollectedBy": "CHEW MARY",
        "sampleCollectionDate": "2025-09-01",
        "sampleCollectionTime": "2025-09-01T09:10:00Z",
        "dateSampleSent": "2025-09-02",
        "priority": 1,
        "packagingCondition": 2,
        "sampleIntegrity": 1,
        "clinicalNotes": "ANC client—3rd trimester."
      },
      {
        "sampleID": "SMP0000003",
        "patientIDs": [
          { "idNumber": "CLI00033456", "idTypeCode": "CLIENTID" }
        ],
        "firstName": "IBRAHIM",
        "surName": "ALI",
        "sex": "M",
        "age": 41,
        "dateOfBirth": "1984-07-04",
        "sampleType": "DBS",
        "indicationVLTest": "Targeted testing",
        "sampleOrderedBy": "Dr. SANI",
        "sampleOrderDate": "2025-09-01",
        "sampleCollectedBy": "Nurse ZARA",
        "sampleCollectionDate": "2025-09-01",
        "sampleCollectionTime": "2025-09-01T10:00:00Z",
        "dateSampleSent": "2025-09-02",
        "priority": 2,
        "packagingCondition": 1,
        "sampleIntegrity": 1,
        "clinicalNotes": "DBS card fully dried."
      },
      {
        "sampleID": "SMP0000004",
        "patientIDs": [
          { "idNumber": "REC00067890", "idTypeCode": "RECENCY" }
        ],
        "firstName": "HALIMA",
        "surName": "GARBA",
        "sex": "F",
        "pregnantBreastFeedingStatus": "Breastfeeding",
        "age": 26,
        "dateOfBirth": "1999-11-15",
        "sampleType": "SERUM",
        "indicationVLTest": "Postpartum monitoring",
        "sampleOrderedBy": "Dr. GABRIEL",
        "sampleOrderDate": "2025-09-01",
        "sampleCollectedBy": "CHEW IBISO",
        "sampleCollectionDate": "2025-09-01",
        "sampleCollectionTime": "2025-09-01T08:55:00Z",
        "dateSampleSent": "2025-09-02",
        "priority": 2,
        "packagingCondition": 2,
        "sampleIntegrity": 2,
        "clinicalNotes": "Minor leakage observed; re-sealed."
      },
      {
        "sampleID": "SMP0000005",
        "patientIDs": [
          { "idNumber": "HOSP0005567", "idTypeCode": "HOSPITALNO" }
        ],
        "firstName": "CHINEDU",
        "surName": "OKAFOR",
        "sex": "M",
        "age": 32,
        "dateOfBirth": "1993-12-30",
        "sampleType": "PLASMA",
        "indicationVLTest": "Routine monitoring",
        "artCommencementDate": "2020-06-18",
        "drugRegimen": "AZT/3TC/EFV",
        "sampleOrderedBy": "Dr. BOLA",
        "sampleOrderDate": "2025-09-01",
        "sampleCollectedBy": "Nurse KEMI",
        "sampleCollectionDate": "2025-09-01",
        "sampleCollectionTime": "2025-09-01T11:20:00Z",
        "dateSampleSent": "2025-09-02",
        "priority": 2,
        "packagingCondition": 3,
        "sampleIntegrity": 1
      },
      {
        "sampleID": "SMP0000006",
        "patientIDs": [
          { "idNumber": "CLI00077890", "idTypeCode": "CLIENTID" }
        ],
        "firstName": "MARYAM",
        "surName": "LAWAL",
        "sex": "F",
        "pregnantBreastFeedingStatus": "NotApplicable",
        "age": 22,
        "dateOfBirth": "2003-08-22",
        "sampleType": "DBS",
        "indicationVLTest": "Baseline",
        "sampleOrderedBy": "Dr. RABIU",
        "sampleOrderDate": "2025-09-01",
        "sampleCollectedBy": "CHEW BUKKY",
        "sampleCollectionDate": "2025-09-01",
        "sampleCollectionTime": "2025-09-01T12:05:00Z",
        "dateSampleSent": "2025-09-02",
        "priority": 2,
        "packagingCondition": 1,
        "sampleIntegrity": 1,
        "clinicalNotes": "New enrollment."
      },
      {
        "sampleID": "SMP0000007",
        "patientIDs": [
          { "idNumber": "REC00078901", "idTypeCode": "RECENCY" }
        ],
        "firstName": "SAMUEL",
        "surName": "PETER",
        "sex": "M",
        "age": 45,
        "dateOfBirth": "1980-02-02",
        "sampleType": "PLASMA",
        "indicationVLTest": "Targeted—suspected failure",
        "sampleOrderedBy": "Dr. EFE",
        "sampleOrderDate": "2025-09-01",
        "sampleCollectedBy": "Nurse ADA",
        "sampleCollectionDate": "2025-09-01",
        "sampleCollectionTime": "2025-09-01T07:40:00Z",
        "dateSampleSent": "2025-09-02",
        "priority": 1,
        "packagingCondition": 2,
        "sampleIntegrity": 3,
        "clinicalNotes": "Slight haemolysis; proceed per SOP."
      },
      {
        "sampleID": "SMP0000008",
        "patientIDs": [
          { "idNumber": "HOSP0006678", "idTypeCode": "HOSPITALNO" }
        ],
        "firstName": "AISHA",
        "surName": "YAKUBU",
        "sex": "F",
        "pregnantBreastFeedingStatus": "NotPregnant",
        "age": 30,
        "dateOfBirth": "1995-01-10",
        "sampleType": "SERUM",
        "indicationVLTest": "Routine monitoring",
        "sampleOrderedBy": "Dr. SHOLA",
        "sampleOrderDate": "2025-09-01",
        "sampleCollectedBy": "CHEW RUTH",
        "sampleCollectionDate": "2025-09-01",
        "sampleCollectionTime": "2025-09-01T13:15:00Z",
        "dateSampleSent": "2025-09-02",
        "priority": 2,
        "packagingCondition": 2,
        "sampleIntegrity": 1
      },
      {
        "sampleID": "SMP0000009",
        "patientIDs": [
          { "idNumber": "CLI00088901", "idTypeCode": "CLIENTID" },
          { "idNumber": "REC00089012", "idTypeCode": "RECENCY" }
        ],
        "firstName": "MUSA",
        "surName": "DANLADI",
        "sex": "M",
        "age": 39,
        "dateOfBirth": "1986-06-06",
        "sampleType": "WHOLE_BLOOD",
        "indicationVLTest": "Targeted—recent high VL",
        "sampleOrderedBy": "Dr. IDRIS",
        "sampleOrderDate": "2025-09-01",
        "sampleCollectedBy": "Nurse FATI",
        "sampleCollectionDate": "2025-09-01",
        "sampleCollectionTime": "2025-09-01T14:05:00Z",
        "dateSampleSent": "2025-09-02",
        "priority": 1,
        "packagingCondition": 2,
        "sampleIntegrity": 4,
        "clinicalNotes": "Insufficient volume noted at facility."
      },
      {
        "sampleID": "SMP0000010",
        "patientIDs": [
          { "idNumber": "HOSP0007789", "idTypeCode": "HOSPITALNO" }
        ],
        "firstName": "RUKAYYAT",
        "surName": "AHMAD",
        "sex": "F",
        "pregnantBreastFeedingStatus": "NotPregnant",
        "age": 29,
        "dateOfBirth": "1996-04-25",
        "sampleType": "PLASMA",
        "indicationVLTest": "Routine monitoring",
        "artCommencementDate": "2022-04-01",
        "drugRegimen": "TDF/3TC/DTG",
        "sampleOrderedBy": "Dr. JOSHUA",
        "sampleOrderDate": "2025-09-01",
        "sampleCollectedBy": "CHEW LUKMAN",
        "sampleCollectionDate": "2025-09-01",
        "sampleCollectionTime": "2025-09-01T15:10:00Z",
        "dateSampleSent": "2025-09-02",
        "priority": 2,
        "packagingCondition": 2,
        "sampleIntegrity": 1
      },
      {
        "sampleID": "SMP0000011",
        "patientIDs": [
          { "idNumber": "REC00090123", "idTypeCode": "RECENCY" }
        ],
        "firstName": "PATIENCE",
        "surName": "OKORO",
        "sex": "F",
        "pregnantBreastFeedingStatus": "NotPregnant",
        "age": 36,
        "dateOfBirth": "1989-09-19",
        "sampleType": "PLASMA",
        "indicationVLTest": "Targeted—ADR suspected",
        "sampleOrderedBy": "Dr. MOSES",
        "sampleOrderDate": "2025-09-01",
        "sampleCollectedBy": "Nurse JANE",
        "sampleCollectionDate": "2025-09-01",
        "sampleCollectionTime": "2025-09-01T16:30:00Z",
        "dateSampleSent": "2025-09-02",
        "priority": 2,
        "packagingCondition": 2,
        "sampleIntegrity": 1,
        "clinicalNotes": "Adherence counseling ongoing."
      },
      {
        "sampleID": "SMP0000012",
        "patientIDs": [
          { "idNumber": "HOSP0009900", "idTypeCode": "HOSPITALNO" }
        ],